[
  {
    "id": "sys.kazik.jar.first",
    "who": "bobr",
    "ru": "Это слово ты помнишь уже месяц. Закатываем. Варшава приезжих зовёт słoiki, так что мы с тобой оба банки.",
    "pl": "Dojrzało. Do słoika!",
    "plRu": "Созрело. В банку!"
  },
  {
    "id": "sys.kazik.order.first",
    "who": "bobr",
    "ru": "Банки не для полки. Бася просит три слова. Донеси и собери из них фразу прямо у неё. Zamówienie - заказ. Zakaz - запрет. Перепутаешь, будет запрет на пироги.",
    "pl": "Pani Basia ma zamówienie.",
    "plRu": "У пани Баси заказ."
  },
  {
    "id": "sys.kazik.kitchen.first",
    "who": "bobr",
    "ru": "Хочешь ещё новое слово сегодня? Три старых в кастрюлю. Слова не пропадут, банки вернутся, когда вспомнишь. Раз в день, я не повар.",
    "pl": "Trzy słoiki, jeden pieróg.",
    "plRu": "Три банки - один пирог."
  },
  {
    "id": "sys.kazik.hearts.cool",
    "who": "bobr",
    "ru": "Давно не повторял её слова, она тебя будто не узнаёт. Отнеси заказ, оттает.",
    "pl": "Pani Basia patrzy dziwnie.",
    "plRu": "Пани Бася странно смотрит."
  },
  {
    "id": "kazik.shadow.first",
    "who": "bobr",
    "ru": "Проверять не буду, я не слышу. Скажи вслух, никто не смотрит. Ну, кроме меня.",
    "pl": "Powtórz na głos.",
    "plRu": "Повтори вслух."
  },
  { "id": "ch02.kazik.odwrotnie", "who": "bobr", "pl": "Ja robię odwrotnie.", "plRu": "А я наоборот." },
  { "id": "kazik.dream.gryze", "who": "bobr", "pl": "Ja nie czytam. Ja gryzę.", "plRu": "Я не читаю. Я грызу." },
  {
    "id": "d01.narr.card.1",
    "who": "narrator",
    "ru": "Октябрь. Варшава. Правый берег."
  },
  {
    "id": "d01.fotobudka.1",
    "who": "fotobudka",
    "pl": "Bez uśmiechu, proszę.",
    "plRu": "Без улыбки, пожалуйста.",
    "words": [
      "lx.prosze"
    ]
  },
  {
    "id": "d01.narr.fotobudka.1",
    "who": "narrator",
    "ru": "Фото на документы. Документов пока нет."
  },
  {
    "id": "d01.kazik.platform.1",
    "who": "bobr",
    "pl": "Dobra kłoda!",
    "plRu": "Хорошее бревно!"
  },
  {
    "id": "d01.narr.platform.1",
    "who": "narrator",
    "ru": "Бобр. В Варшаве бывает."
  },
  {
    "id": "d01.dima.platform.1",
    "who": "dima",
    "ru": "#@!%"
  },
  {
    "id": "d01.kazik.platform.2",
    "who": "bobr",
    "ru": "О! По-русски ругаешься? Свои. Держи чемодан."
  },
  {
    "id": "d01.kazik.platform.3",
    "who": "bobr",
    "ru": "Я Казик. С Буга: это река на границе."
  },
  {
    "id": "d01.kazik.platform.4",
    "who": "bobr",
    "ru": "Рыбы там на двух языках. Я тоже."
  },
  {
    "id": "d01.kazik.platform.5",
    "who": "bobr",
    "ru": "Звук у тебя есть? Если ты в метро, скажи: буду буквами."
  },
  {
    "id": "d01.kazik.platform.6a",
    "who": "bobr",
    "pl": "Dobra.",
    "plRu": "Ладно."
  },
  {
    "id": "d01.kazik.platform.6b",
    "who": "bobr",
    "ru": "Понял. Тихо, как бобр в засаде."
  },
  {
    "id": "d01.kazik.platform.7",
    "who": "bobr",
    "ru": "Мне на базар, там ящик. Со мной люди не говорят: я бобр."
  },
  {
    "id": "d01.kazik.platform.8",
    "who": "bobr",
    "ru": "Скажешь за меня? Пошли."
  },
  {
    "id": "d01.kazik.platform.go",
    "who": "bobr",
    "pl": "Idziemy!",
    "plRu": "Идём!"
  },
  {
    "id": "d01.kazik.street.1",
    "who": "bobr",
    "ru": "Что там написано?"
  },
  {
    "id": "d01.kazik.street.2",
    "who": "bobr",
    "pl": "Ja nie czytam. Ja gryzę.",
    "plRu": "Я не читаю. Я грызу."
  },
  {
    "id": "d01.sign.bazar",
    "who": "tablica",
    "pl": "BAZAR →",
    "plRu": "Базар →"
  },
  {
    "id": "d01.kazik.street.3",
    "who": "bobr",
    "ru": "Базар. Значит, ты будешь читать, я грызть. Честно."
  },
  {
    "id": "d01.sign.zaraz",
    "who": "tablica",
    "pl": "ZARAZ WRACAM",
    "plRu": "Сейчас вернусь"
  },
  {
    "id": "d01.kazik.street.zaraz",
    "who": "bobr",
    "ru": "Висит всегда. «Zaraz» тут от минуты до вечера."
  },
  {
    "id": "d01.kazik.bazar.1",
    "who": "bobr",
    "ru": "Вон ящик. Скажи ей «Dzień dobry»: здравствуйте.",
    "words": [
      "lx.dzien_dobry"
    ]
  },
  {
    "id": "d01.hela.bazar.1",
    "who": "pani_hela",
    "pl": "Tak?",
    "plRu": "Да?"
  },
  {
    "id": "d01.hela.bazar.2",
    "who": "pani_hela",
    "pl": "Dzień dobry!",
    "plRu": "Здравствуйте!",
    "words": [
      "lx.dzien_dobry"
    ]
  },
  {
    "id": "d01.kazik.bazar.2",
    "who": "bobr",
    "pl": "No proszę. Gość mówi!",
    "plRu": "Ну надо же. Гость говорит!"
  },
  {
    "id": "d01.ui.umiem.1",
    "who": "narrator",
    "pl": "Umiem: przywitać się",
    "plRu": "Умею: здороваться"
  },
  {
    "id": "d01.hela.bazar.err.1",
    "who": "pani_hela",
    "pl": "Do widzenia? Pan dopiero przyszedł!",
    "plRu": "До свидания? Вы же только пришли!"
  },
  {
    "id": "d01.rule.dzien_dobry",
    "who": "narrator",
    "ru": "Dzień dobry: при встрече. Do widzenia: на прощание.",
    "words": [
      "lx.dzien_dobry"
    ]
  },
  {
    "id": "d01.rule.dzien_dobry.tr",
    "who": "narrator",
    "pl": "Do widzenia",
    "plRu": "До свидания"
  },
  {
    "id": "d01.hela.bazar.3",
    "who": "pani_hela",
    "pl": "Pan bierze? Za darmo.",
    "plRu": "Берёте? Даром."
  },
  {
    "id": "d01.hela.bazar.4",
    "who": "pani_hela",
    "pl": "To też za darmo.",
    "plRu": "Это тоже даром."
  },
  {
    "id": "d01.kazik.bazar.3",
    "who": "bobr",
    "pl": "Prawie kłoda.",
    "plRu": "Почти бревно."
  },
  {
    "id": "d01.passport.note",
    "who": "narrator",
    "pl": "Dla następnego gościa. - K.",
    "plRu": "Для следующего гостя. - K."
  },
  {
    "id": "d01.narr.passport.1",
    "who": "narrator",
    "ru": "Паспорт гостя. Пустой. Фото подошло."
  },
  {
    "id": "d01.hela.bazar.5",
    "who": "pani_hela",
    "pl": "I pieczątka. Gratis.",
    "plRu": "И печать. Бесплатно."
  },
  {
    "id": "d01.kazik.bazar.4",
    "who": "bobr",
    "ru": "Первая печать. Кривая, но наша."
  },
  {
    "id": "d01.kazik.bazar.5",
    "who": "bobr",
    "ru": "Это паспорт гостя. Печать ставит тот, с кем ты поговорил."
  },
  {
    "id": "d01.kazik.bazar.6",
    "who": "bobr",
    "ru": "Главная тут Прага. Её ставит контролёр в метро. Доберёмся."
  },
  {
    "id": "d01.kazik.bazar.7",
    "who": "bobr",
    "ru": "А что там за «K.»? Не я. Я не пишу. Я грызу."
  },
  { "id": "sys.jeszcze", "who": "narrator", "pl": "Jeszcze raz.", "plRu": "Ещё раз." },
  { "id": "d02.ui.title", "who": "narrator", "pl": "Dzień 2. Bramka słucha", "plRu": "День 2. Турникет слушает" },
  { "id": "d02.kazik.obchod.1", "who": "bobr", "pl": "Zrobiłem znak.", "plRu": "Я сделал зарубку." },
  { "id": "d02.kazik.obchod.2", "who": "bobr", "ru": "Где зарубка, там слово просится. Обойди и полей." },
  { "id": "d02.kazik.obchod.err", "who": "bobr", "ru": "Ещё зарубка. Завтра спросит снова." },
  { "id": "d02.kazik.obchod.3", "who": "bobr", "pl": "Wszystko podlane.", "plRu": "Всё полито." },
  { "id": "d02.kazik.mail.1", "who": "bobr", "ru": "Почта! Мне никогда не пишут. Читай." },
  { "id": "d02.letter.brzechwa", "who": "narrator", "pl": "Metro Centrum. Bramka. Dziś! J.B.", "plRu": "Метро Centrum. Турникет. Сегодня! Я.Б." },
  { "id": "d02.kazik.mail.2", "who": "bobr", "ru": "Это вчерашний, со шляпой. Метро на том берегу." },
  { "id": "d02.kazik.mail.3", "who": "bobr", "ru": "Пойдём по чужому мосту. Пока по чужому." },
  { "id": "d02.kazik.most.1", "who": "bobr", "pl": "Ładny most. Mój będzie lepszy.", "plRu": "Красивый мост. Мой будет лучше." },
  { "id": "d02.kazik.schody.1", "who": "bobr", "pl": "To nie moje.", "plRu": "Это не моё." },
  { "id": "d02.kazik.schody.2", "who": "bobr", "ru": "У меня лапы с перепонками. Тут кто-то поменьше." },
  { "id": "d02.brzechwa.bramka.1", "who": "brzechwa", "pl": "Cześć, Dima! Zima!", "plRu": "Привет, Дима! Зима!" },
  { "id": "d02.brzechwa.bramka.2", "who": "brzechwa", "pl": "Ta bramka słucha.", "plRu": "Этот турникет слушает." },
  { "id": "d02.kazik.bramka.1", "who": "bobr", "ru": "Пускает тех, кто слышит город. Не экзамен: 12 звуков." },
  { "id": "d02.dima.bramka.start", "who": "dima", "pl": "Słucham!", "plRu": "Слушаю!", "words": ["lx.slucham"] },
  { "id": "d02.bramka.ok", "who": "narrator", "pl": "Pip!", "plRu": "Пип!" },
  { "id": "d02.bramka.err", "who": "narrator", "pl": "Hyk!", "plRu": "Ик!" },
  { "id": "d02.kazik.bramka.mid", "who": "bobr", "ru": "Устал? Кнопка «Wyjdź». Турникет подождёт до завтра." },
  { "id": "d02.brzechwa.bramka.exit", "who": "brzechwa", "pl": "Do jutra! Bramka poczeka.", "plRu": "До завтра! Турникет подождёт." },
  { "id": "d02.brzechwa.result.1", "who": "brzechwa", "pl": "Brawo! Bramka otwarta!", "plRu": "Браво! Турникет открыт!" },
  { "id": "d02.kazik.result.1", "who": "bobr", "ru": "Вот карта звуков. Зелёное держит, красное шатается." },
  { "id": "d02.kazik.result.2", "who": "bobr", "ru": "Красное подлатаем. По кусочку в день, с завтра." },
  { "id": "d02.kazik.result.allgreen", "who": "bobr", "ru": "Всё зелёное? Ты меня пугаешь. Ладно, пойдём быстрее." },
  { "id": "d02.brzechwa.peron.1", "who": "brzechwa", "pl": "Powiesz: „chrząszcz”. Ale nie dziś.", "plRu": "Скажешь: «chrząszcz». Но не сегодня." },
  { "id": "d02.kazik.peron.1", "who": "bobr", "ru": "Это жук. Самое страшное слово. Я его боюсь." },
  { "id": "d02.brzechwa.peron.2", "who": "brzechwa", "pl": "Słuchaj Warszawy! Cześć!", "plRu": "Слушай Варшаву! Пока!" },
  { "id": "d02.kazik.hut.1", "who": "bobr", "ru": "Турникет пустил. Контролёр будет строже. Спим." },
  { "id": "d02.ui.hook", "who": "narrator", "pl": "Jutro: piszesz sam.", "plRu": "Завтра пишешь сам." },
  { "id": "d03.ui.title", "who": "narrator", "pl": "Dzień 3. Ogonek", "plRu": "День 3. Хвостик" },
  { "id": "d03.kazik.obchod.1", "who": "bobr", "ru": "«Dzień dobry» уже крепкое. Сегодня собери его сам, из кусков.", "words": ["lx.dzien_dobry"] },
  { "id": "d03.kazik.obchod.2", "who": "bobr", "ru": "На моём ящике кто-то сидел. Тёплый ещё." },
  { "id": "d03.kazik.obchod.3", "who": "bobr", "pl": "Ktoś tu siedział.", "plRu": "Кто-то тут сидел." },